{"checkpoint":{"algorithm":"verifyum-sha256-merkle-v1","checkpoint_hash":"sha256:bc3653e93164e62d0bc1272b2d76eace51df7951d692a3138991c144c631728c","created_at":"2026-08-31T19:06:04Z","kind":"hourly","merkle_root":"sha256:dbde1e168a15113d88b12c28192ed236d85b23ae5479812d930888e9c6664e54","network":"mainnet-beta","period_end":"2026-08-31T19:00:00Z","period_start":"2026-08-31T18:00:00Z","previous_checkpoint_hash":null,"protocol":"verifyum","schema":"https://verifyum.com/schema/witness-checkpoint-v1.json","subject_count":5,"subject_type":"proof-v2","version":1},"checkpoint_url":"https://verifyum.com/witness/checkpoints/hourly/20260831T180000Z-bc3653e93164e62d0bc1272b2d76eace51df7951d692a3138991c144c631728c.json","membership":{"checkpoint_hash":"sha256:bc3653e93164e62d0bc1272b2d76eace51df7951d692a3138991c144c631728c","checkpoint_kind":"hourly","leaf_count":5,"leaf_hash":"sha256:4daa8b55d67b55edaa111c2b76e184cccc2fedc88a034b023ea91170ef6c871d","leaf_index":2,"path":[{"hash":"sha256:133ef7c081644498ee861ddff1fc35b39db3a60c7c440bf66b42d836f4cab1df","side":"right"},{"hash":"sha256:37a338343120800789837fb05d03bcd637f3111d4d9cc5f6ed1d69dafd59365a","side":"left"},{"hash":"sha256:67f17934a548cfaa992523ec77f8dc21e347881c8a6a6768cff41082fed7802e","side":"right"}],"protocol":"verifyum","schema":"https://verifyum.com/schema/witness-membership-v1.json","subject_id":"1ns0c79n4m0sy5es4wztcvrm1y","subject_type":"proof-v2","version":1},"network":"mainnet-beta","proof_id":"1ns0c79n4m0sy5es4wztcvrm1y","protocol":"verifyum","schema":"https://verifyum.com/schema/witness-proof-membership-v1.json","version":1}
